[
    {
        "question": "How often do meteorites hit the US",
        "historical_rate": 0.024489795918367346,
        "start_date": "1900-01-01T00:00:00",
        "end_date": "2024-10-07T00:00:00",
        "numerator_reference_class": {
            "start_date": "1900-01-01T00:00:00",
            "end_date": "2024-10-07T00:00:00",
            "hit_definition": "A meteorite hits the US",
            "hit_description_with_dates_included": "Times that meteorites hit the US between Jan 1, 1900 and Oct 7, 2024",
            "count": 1116,
            "reasoning": "\nI estimate that there are 1116 Times that meteorites hit the US between Jan 1, 1900 and Oct 7, 2024\n\n**Facts**:\n- On average, approximately 1.3 meteorite falls are recovered in the United States each year [A](https://sites.wustl.edu/meteoritesite/items/meteorites-in-the-united-states/#:~:text=On%20average%2C%20that%20is%201.3,between%201922%20and%202023%20%2891%29.)\n- Over the past 212 years, a total of 1,924 meteorites have been found and verified in the U.S., which averages to about 9 meteorites per year when considering both finds and falls [A](https://sites.wustl.edu/meteoritesite/items/meteorites-in-the-united-states/#:~:text=The%20highest%20found%2Dmeteorite%20densities%20have,is%20about%209%20per%20year.)\n- The number of falls from 1807 through 1906 (52) is only 60% less than the number of falls in the last 100 years, between 1922 and 2023 (91) \\[[1](https://sites.wustl.edu/meteoritesite/items/meteorites-in-the-united-states/#:~:text=On%20average%2C%20that%20is%201.3,between%201922%20and%202023%20%2891%29.)\\].\n\n**Estimation**:\n1. Calculate the number of years between 1900 and 2024: 2024 - 1900 = 124 years.\n2. Use the average of 9 meteorites per year (finds and falls) to estimate the total number of meteorites: 124 years * 9 meteorites/year = 1,116 meteorites.\n3. Given that the number of falls from 1807 through 1906 is 60% less than the number of falls from 1922 to 2023, we can assume a similar distribution for the period from 1900 to 2024, supporting the use of the average rate.\n"
        },
        "denominator_reference_class": {
            "start_date": "1900-01-01T00:00:00",
            "end_date": "2024-10-07T00:00:00",
            "hit_definition": "A day within the start date to end date period",
            "hit_description_with_dates_included": "Days between Jan 01, 1900 and Oct 07, 2024",
            "count": 45570,
            "reasoning": "I caculated the number of days between the start and end date using code."
        },
        "denominator_type": "per day",
        "markdown_report": "\n**Cost of base rate report**: $0.12\n\n**Base Rate**: 2.45%\n\n### Results\n- Chances of A meteorite hits the US: 2.449% per day, 52.47% per month, 99.99% per year\n- Numerator Size: 1116 Times that meteorites hit the US between Jan 1, 1900 and Oct 7, 2024\n- Denominator Size: 45570 Days between Jan 01, 1900 and Oct 07, 2024\n- Date Range: Jan 01, 1900 to Oct 07, 2024 | 45570 days, 1519.00 months, 124.85 years\n\n### Background Information\nOn average, approximately 1.3 meteorite falls are recovered in the United States each year \\[[1](https://sites.wustl.edu/meteoritesite/items/meteorites-in-the-united-states/#:~:text=On%20average%2C%20that%20is%201.3,between%201922%20and%202023%20%2891%29.)\\]. Over the past 212 years, a total of 1,924 meteorites have been found and verified in the U.S., which averages to about 9 meteorites per year when considering both finds and falls \\[[10](https://sites.wustl.edu/meteoritesite/items/meteorites-in-the-united-states/#:~:text=The%20highest%20found%2Dmeteorite%20densities%20have,is%20about%209%20per%20year.)\\]. It's important to note that many meteorites fall in remote or mountainous areas, making them less likely to be discovered \\[[4](https://vividmaps.com/meteorites/#:~:text=About%20five%20hundred%20meteorites%20of,happens%20to%20the%20fallen%20meteorite.)\\]. The distribution of meteorite finds varies by state, with higher densities in states like New Mexico, Kansas, and Nevada \\[[10](https://sites.wustl.edu/meteoritesite/items/meteorites-in-the-united-states/#:~:text=The%20highest%20found%2Dmeteorite%20densities%20have,is%20about%209%20per%20year.)\\].\n\n### Numerator\n**Size Found**: 1116 | **Hit Definition**: A meteorite hits the US\n\n**Explanation**:\n\nI estimate that there are 1116 Times that meteorites hit the US between Jan 1, 1900 and Oct 7, 2024\n\n**Facts**:\n- On average, approximately 1.3 meteorite falls are recovered in the United States each year [A](https://sites.wustl.edu/meteoritesite/items/meteorites-in-the-united-states/#:~:text=On%20average%2C%20that%20is%201.3,between%201922%20and%202023%20%2891%29.)\n- Over the past 212 years, a total of 1,924 meteorites have been found and verified in the U.S., which averages to about 9 meteorites per year when considering both finds and falls [A](https://sites.wustl.edu/meteoritesite/items/meteorites-in-the-united-states/#:~:text=The%20highest%20found%2Dmeteorite%20densities%20have,is%20about%209%20per%20year.)\n- The number of falls from 1807 through 1906 (52) is only 60% less than the number of falls in the last 100 years, between 1922 and 2023 (91) \\[[1](https://sites.wustl.edu/meteoritesite/items/meteorites-in-the-united-states/#:~:text=On%20average%2C%20that%20is%201.3,between%201922%20and%202023%20%2891%29.)\\].\n\n**Estimation**:\n1. Calculate the number of years between 1900 and 2024: 2024 - 1900 = 124 years.\n2. Use the average of 9 meteorites per year (finds and falls) to estimate the total number of meteorites: 124 years * 9 meteorites/year = 1,116 meteorites.\n3. Given that the number of falls from 1807 through 1906 is 60% less than the number of falls from 1922 to 2023, we can assume a similar distribution for the period from 1900 to 2024, supporting the use of the average rate.\n\n\n### Denominator\n**Size Found**: 45570 | **Hit Definition**: A day within the start date to end date period\n\n**Explanation**:\nI caculated the number of days between the start and end date using code.\n"
    }
]
